{
  "id": "job_01JAB2C3D4E5F6G7H8J9K0MNPQ",
  "object": "tools.job",
  "service": "img",
  "type": "img.process",
  "type_version": 1,
  "state": "queued",
  "progress": {
    "percent": null,
    "message": null
  },
  "attempts": 0,
  "max_attempts": 3,
  "cancel_requested": false,
  "created_at": "2026-09-23T09:00:00.000Z",
  "started_at": null,
  "finished_at": null,
  "expires_at": "2026-09-23T10:00:00.000Z",
  "result": null,
  "error": null,
  "retryable": false,
  "retry_of": null,
  "retried_by": null,
  "references": [],
  "links": {
    "self": "/api/v1/jobs/job_01JAB2C3D4E5F6G7H8J9K0MNPQ",
    "events": "/api/v1/jobs/job_01JAB2C3D4E5F6G7H8J9K0MNPQ/events",
    "cancel": "/api/v1/jobs/job_01JAB2C3D4E5F6G7H8J9K0MNPQ",
    "retry": null,
    "retried_by": null
  }
}
